Source Link,Date  of adding Lead,Business Name,Location,Description of Business Operations,Asking Price,Revenue,Cash Flow or EBITDA,FF&E value,Real Estate information (if available),Calculated Profit Margin,Estimated Payback Period,Master Score ,SBA ,,Worker
Project (709): Scrapping and Data Mining,,,,,,,,,,,,,,,
California,,,,,,,,,,,,,,,
https://www.bizbuysell.com/Business-Opportunity/profitable-history-in-this-tree-sales-and-moving-company/2276445/,,Profitable History in this Tree Sales & Moving Company,California,"This successful business is known across the state and has very consistent profit and growth as a tree sales and tree moving company. In business for many years, this specialized business has been providing and moving beautiful mature olive trees, oak trees and palm trees for landscape architects, contractors, developers, and homeowners. They move other trees as well! Equipped with heavy duty and meticulously maintained equipment, the new owner would immediately step into a turnkey business. NDA and Confidential Buyer Profile is required prior to release of financials.","$799,900","$765,000","$225,000","$366,000",,29.41%,3.56,,,,Zeeshan
https://www.bizbuysell.com/Business-Opportunity/prosperous-well-established-restaurant-for-sale/2273062/,,Prosperous Well Established Restaurant for Sale,"Clovis, CA","Great Opportunity to own a well established prosperous popular restaurant.
Owners are retiring.
Full service restaurant with bar, banquet room and patio dining. Located in a high traffic area with a well established retail area full of stores, markets and restaurants.","$599,000","$1,500,000","$250,000","$200,000",,16.67%,2.4,,,,Zeeshan
https://www.bizbuysell.com/Business-Opportunity/1-triumph-dealership-in-north-america-for-sale/2260873/,,#1 Triumph Dealership in North America for sale!,"Brea, CA","#1 Triumph dealer OF ALL TIME in North America#1 Royal Enfield dealership in the USTurn-key with strong management in placePress fleets for Triumph & Royal EnfieldProfitable, boutique dealership in a thriving marketSouthern California Motorcycles carries Triumph, Royal Enfield, Suzuki and Ducati, yet is designed so that all the manufacturers consider it a single-line flagship for their brand. This gives the dealership the ability to participate in special programs and incentives.It is the highest volume of Triumph sales in North America and is the top Royal Enfield dealership in the US. The dealership has garnered several sales volume AND customer service awards.Southern California Motorcycles manages the press fleets for Triumph and Royal Enfield - providing motocycles for movies, press releases, advertisements and photo shoots.There are two service departments, with Triumph having its own, and one centrally located customer-facing parts counter. The company has parts and accessories merchandising displays matched to the brands and types of motorcycles spread throughout the showrooms.Sales price includes all furniture, fixtures, equipment and paid-for inventory. Any new motorcycle inventory on flooring to be rolled onto new LOC. An experienced management team is in place to make this a turnkey, profitable opportunity.Real Estate: The dealership real estate is leased. Current landlord is willing to lease to an approved new tenant for 5 years but is not looking to sell the property. The warehouse (where major unit inventory is delivered and assembled) is a mile away. Current dealership owner also owns the warehouse and is willing to lease or sell property to new dealership owner.Customer base: The dealership team is very focused on delivering outstanding customer service. Please take a look at Google and Yelp reviews. There are many repeat customers who not only return to buy gear, accessories and supplies, but also to buy additional motorcycles. The customer base is also very diverse, from young families to individuals of all ages, riding interests and abilities.","$2,500,000","$10,000,000","$450,000","$450,000",,4.50%,5.56,,,,Zeeshan
https://www.bizbuysell.com/Business-Opportunity/established-turnkey-business-with-social-media-following/2188639/,,"Established, Turnkey Business with Social Media Following","Palm Springs, CA","It's the first location with delicious, crave-able product offerings (some that are very unique) in a trendy themed fast casual concept in a world famous city. Currently a day business that has plenty of room to grow along with an exceptionally low lease for California, which leaves more room to bring even more cash flow to the bottom line. Established loyalty rewards program, delivery service using 3rd party platforms (2) and room to join more. Easy kiosk option with current POS system. Built in email and text marketing program along with e-gift cards and traditional gift card (currently in use). Large parking lot with plenty of spaces, other retail shops and long established fast food icon, in the center. Located near multiple residents and high end condos directly behind the business and has gorgeous views.","$425,000","$505,000","$100,000","$225,000",,19.80%,4.25,,,,Zeeshan
https://www.bizbuysell.com/Business-Opportunity/construction-company-with-tools-and-equipment-included/2127744/,,Construction company with Tools and Equipment Included,"San Jose, CA","Construction company (diamond certified) with tools and equipment (value $40,000) can be sold separately from Goodwill of the company with 48 years in business and the name, phone numbers and website to go with it. Construction business has general contractors license with business name, may be transferable. Early GC license in good standing, early number from the mid 80’s.May be required for buyer to have their own general contractors license or may be transferable.48 years in business with about 3000 customers served for remodeling. Current customer database has file with about 800 names from these more current customers and referral base. We send out a newsletter to these addresses periodically. We have project records going back 20 years.We have many projects that serve as excellent referrals that can be shown to new clients as you are selling them work. This is very important to show quality and performance with a high customer satisfaction. This greatly helps with closing projects and signing them up as well as getting a good price for the contract based on higher quality. We have excellent references. We have good yelp reviews. we have good credit rating through Dunn and Bradstreet. We have many active Supplier accounts with good credit rating.Business is built on direct customer service where we are first point of contact rather than secondary contacts, such as through realtors architects or designers referring us work. Although professionals in the field recommend us, our database is proprietary and built directly with our customers. Having our own direct contacts that call us first when they need work, stabilizes our goodwill and referrals and ensures, a hardier referral base that does not evaporate through time as business contacts can sometimes do.Previous years gross income has been above 4 million.Tools and equipment can be sold separately or included in sale.General questions can be answered by phone, but for more specific questions a Non-Disclosure Agreement will need to be signed.","$1,800,000","$1,800,000","$143,000","$50,000",,7.94%,12.59,,,,Zeeshan
https://www.bizbuysell.com/Business-Opportunity/highly-profitable-established-food-truck-with-big-money-contracts/2306771/,,Highly profitable Established Food Truck With Big Money Contracts,"Los Angeles, CA","Flamin Hot Chicken is an established Food Truck which started off as a pop up in the streets in 2018, we quickly worked our way up to a food truck and secured a couple high budget contracts including Catering for UCLA, Space X, Tesla and many prepaid Catering requests with NO money spent on Advertising, literally $0.00The truck is a 2016 Ford F59 with a kitchen built to pump out high volumes of orders in short periods of time, Kitchen Built in 2022, we used a reputable Food Truck Builder called Superior Catering and the truck has only the highest quality appliances and build out.The Kitchen has been thoroughly thought out for minimal room for errors or maintenance, I designed this layout and setup through trial/error after changing 3 trucks and it works perfectly, imagine a fast food restaurant on wheels, customers order from one end of the truck and production travels to the other end of the truck in a line for a seamless transaction.Has a self ordering Kiosk powered by Toast and 2 kitchen displays, to minimize staff wasting time taking orders and helping out in the kitchen instead, on the flip side it can also be used as Kiosk with a employee and face behind it, POS system has a auto CA Sales Tax Calculating software to set aside collected sales tax and does filing automatically to further simplify the management side of things, EVERYTHING is thought out for this business and you can start making money from day one.With current contracts and Pre Paid Caterings this business can easily generate $45,000 a month working only 10-15 days.This is a once in a lifetime opportunity to own a business that will give back to you starting from the day you own it, with simple recipes and procedures almost anyone can do it.I will help in every single aspect necessary to have a seamless transfer of Ownership.Leasing Option for Food Truck & Business Available as well, $50,000 Startup with $10,000 a month, open for lease Term options, truck is owned and paid off so possibilities are endless.Existing Grade A California Health Permit & Hard to obtain Los Angles County Permit, City Of Hawthorne Permit.Expired Long Beach Health and City Permits, Santa Monica ""Just needs to be paid, didn't need them so we did not Re-New""Has room for a stand up Freezer or more equipment if necessary ""Wont Need Anything Though""Equipped with3x 2 Door Counter Refrigerators1x 2 Door Sandwich Prep Refrigerator1x 60lb Fryer1x 90lb Fryer1x Stand up Toaster1x 3 Compartment Sink1x Water heater1x XL Propane Tank ""Minimal Fill ups Required""1x High Ceiling Window & Vent Kit ""Super Spacious""2x A/C System2x 9000 Watt Generators ""1 For Back Up In Case Of Emergency""2x Battery Backups for sensitive electronics such a Kiosk, Kitchen Display or CamerasSo Much More to LIST!Call with any questions and Ill be sure to answer all of them and also give more details about the truck and the business!","$595,000","$585,000","$433,000","$185,000",,74.02%,1.37,,,,Zeeshan
https://www.bizbuysell.com/Business-Opportunity/security-cameras-access-control-saas-reseller-with-turn-key-product/2291268/,,Security Cameras\Access Control (SAAS Reseller with Turn Key Product),"San Francisco, CA","We are a Verkada reseller specializing in video security and surveillance. We have a strong presence in the government, state, local, and education sectors. We are listed on all major contracts, some of which take years to secure.These include NASBO, PEPPM, and CMAS. Additionally, we are on several local and state contracts. Our robust customer base consists of cities, schools, and local government agencies. We also serve a diverse mix of industries, including manufacturing and hospitality.Our top-selling products are security cameras, though we also generate significant sales from access control systems and environmental sensors. We offer a comprehensive demo environment for customer demonstrations and extensive sales, marketing, and training materials.This division of our business is performing strongly, and we are seeking a buyer interested in acquiring a turnkey, ready-to-go business.","$1,800,000","$5,963,855","$800,000",$200,,13.41%,2.25,,,,Zeeshan
https://www.bizbuysell.com/Business-Opportunity/car-wash-with-real-estate-express-newly-established-100-emp-run/2286024/,,Car Wash with Real Estate - Express - Newly Established - 100% Emp Run,"Tulare County, CA","Rare opportunity to purchase a very attractive, newly established, top of line, McNeil Built, Express Car Wash with Real Estate.Please note, that this Express Car Wash with Real Estate is McNeil built and upon site visit becomes abundantly clear that no expense has been spared in this establishment.Please note, that this very desirable Express Car Wash is located in an upscale premium trade area on a major busy street.Surrounded by populated business and residential communities, provide this business with a steady volume of vehicle traffic.Financials Highlights August 2024:Sales: $150,928.03SDE(after add backs): $64,762.66Car Count August 2024: 16,240Current Monthly Memberships/Subscriptions: 2525Household Income ½ Mile Radius: $96,500Sales indicate a growth trend, business is relatively newly established, therefore, revenues and SDE has been annualized based on August 2024 financial data.Business is 100% absentee owned and 100% employee operated. Current ownership is resides approximately 200 miles from business location.Seller will provide and verify all financial information during the due diligence period.ALL potential buyers must Sign an NDA, Completed Buyer Profile agree and understand that no direct communication with the facility or administrative staff what-so-ever is expected as a part of the pre-due diligence phase of the sale.Proof of Funds is requested alongside an NDA.Disclaimer: The aforementioned information was furnished by the Seller. Business Brokers and/or its agents have not and will not verify the accuracy or completeness of information provided and make no representations as to its accuracy or reliability. Purchasers are hereby advised to consult with their legal and financial advisors.","$9,995,000","$1,811,000","$776,000",,,42.85%,12.88,,,,Zeeshan
https://www.bizbuysell.com/Business-Opportunity/franchised-juice-bar-upscale-pasadena-location-100-employee-run/2271817/,,Franchised Juice Bar - Upscale Pasadena Location - 100% Employee Run,"Pasadena, CA","Great opportunity to acquire a well-established, 100% absentee owned and 100% employee operated, turn key, franchised juice bar in very desirable and upscale Pasadena Area, County of Los Angeles.Please note, that this desirable franchisee is located on a major busy street inside a large shopping center, providing subject business with a steady volume of traffic.Business establishment also has large inside seating as well as a patio dining area.Current ownership dedicates almost no time and resources for advertisement and promotion of this business and most of its clientele is established repeat or referral, therefore, upside potential, additional revenues and resulting higher bottom line may be realized by actively engaging in advertisement campaigns and utilizing social media.Sellers maintain a full complement of staff with high payroll related expenses.Financial Highlights:Total Gross Sales F.Y. 2023: $488,968.00Total NET Profit/SDE F.Y. 2023: $119,225.00NET/SDE is after Add Backs including GM Salary and based on owner/operator model.Number of Employees: 9, Manager:1Verifiable gross sales, 100% absentee ownership, full complement of staff, busy major street location presents an attractive acquisition opportunity.Acquisition of this Franchise is subject to corporate approval of the incoming buyer. All inspection and viewing of “Back of the House” are by appointment only.This is a Confidential Offering, utmost discretion is requested.ALL potential buyers must Sign an NDA, Completed Buyer Profile agree and understand that no direct communication with the facility or administrative staff what-so-ever is expected as a part of the pre-due diligence phase of the sale.Disclaimer: The aforementioned information was furnished by the Seller. Business Brokers and/or its agents have not and will not verify the accuracy or completeness of information provided and make no representations as to its accuracy or reliability. Purchasers are hereby advised to consult with their legal and financial advisors to the extend they may deem necessary.","$250,000","$488,968","$119,225",,,24.38%,2.1,,,,Zeeshan
https://www.bizbuysell.com/Business-Opportunity/menchies-frozen-yogurt-under-contract/2259385/,,Menchies Frozen Yogurt (Under Contract),"Santa Clarita, CA","Established 15 years ago this Menchies location is a Santa Clarita mainstay. Regarded as one of the ""hubs"" in the city this store has survived everything and is still a very profitable store. With sales reaching as much as $600,000 and a devoted following this is as turnkey as it gets. There are many growth opportunities that Menchies offers as well.","$300,000","$500,000","$100,000",,,20.00%,3,,,,Zeeshan
https://www.bizbuysell.com/Business-Opportunity/sales-and-financial-services/2290587/,,Sales & Financial Services,"San Luis Obispo County, CA","Are you ready to take your business ventures to the next level? Look no further! DiscoverA Profitable Opportunity: It's your chance to invest in a thriving business that combines exceptional sales strategies with robust financial solutions.","$700,000","$1,586,506","$1,156,886","$10,000",,72.92%,0.61,,,,Zeeshan
https://www.bizbuysell.com/Business-Opportunity/remote-operated-speech-therapy-business-for-sale/2308900/,,Remote Operated Speech Therapy Business For Sale,"San Diego, CA",This business specializes in providing speech therapy to children ages 0-3 years of age in their homes and daycare.,"$500,000","$872,184","$386,860",,,44.36%,1.29,,,,Zeeshan
https://www.bizbuysell.com/Business-Opportunity/rare-opportunity-to-own-the-iconic-britannia-arms-pub-and-restaurant/2296001/,,Rare Opportunity to Own The Iconic Britannia Arms Pub & Restaurant,"Monterey County, CA","Britannia Arms is a beloved British-style pub and restaurant and is situated in the heart of Monterey, a vibrant city known for its tourism, natural beauty, and bustling social scene. Just minutes from Cannery Row, Fisherman’s Wharf, and the world-famous Monterey Bay Aquarium, this prime location ensures a steady flow of locals and tourists alike.For decades, the Britannia Arms has been a cherished gathering spot for patrons seeking a lively atmosphere, excellent food, and traditional pub charm. Offering indoor and outdoor seating, a full-service bar, and live entertainment, the venue has become a cornerstone of the Monterey nightlife. Its consistent revenue, reputation for quality, and dedicated customer base provide a solid foundation for a new owner to take the reins and expand its potential.The Britannia Arms boasts a highly visible location with ample parking, pedestrian traffic, and proximity to major attractions and hotels. Its welcoming ambiance and versatile layout make it an ideal venue for private events, sports viewings, and themed nights, ensuring year-round business opportunities. With a fully equipped kitchen, established liquor license, and dedicated staff in place, this turnkey operation is ready for immediate success.Whether you’re a seasoned restaurateur or an aspiring entrepreneur, the Britannia Arms represents an incredible chance to own a piece of Monterey’s history while enjoying the rewards of running a thriving business in a world-class destination. Don’t miss out—contact Carmel Business Sales today to learn more about this great opportunity.If you are interested in learning more, please contact us and we will send you a confidentiality agreement which will allow us to provide you with detailed information (financials, lease, etc.) as well as a back-of-the-house tour.","$995,000","$1,900,000","$400,000",,,21.05%,2.49,,,,Zeeshan
https://www.bizbuysell.com/Business-Opportunity/invest-in-a-high-cash-flow-business-with-unlimited-potential/2265173/,,Invest in a High Cash Flow Business with Unlimited Potential!,"Alameda County, CA","Discover an exceptional opportunity to acquire a high-cash-flow B2B wholesale business with an extensive and loyal customer base of over 1,500 active clients. This well-established operation has consistently generated over $35 million in gross revenue annually for the past 15 years, demonstrating its resilience and market leadership.Housed in a spacious warehouse, the business has ample room to expand operations and significantly increase revenue by adding complementary product lines to meet existing customer needs. Its strategic location provides a competitive edge, allowing for convenient access to a thriving network of businesses that rely on its dependable supply chain.This turnkey operation is ideal for seasoned investors or entrepreneurial owners seeking a profitable business with scalability. The company boasts:A proven track record of profitability and steady growth.Streamlined operations with trained staff and established processes.A database of over 1,500 retail customers ensuring recurring revenue.Confidential Offering:To protect the integrity of the business, additional details, including industry specifics, will only be shared with qualified buyers who execute a Non-Disclosure Agreement (NDA).Don’t miss this rare opportunity to own a thriving business with virtually unlimited growth potential. Reach out today to learn more and take the next step toward owning a lucrative enterprise.","$2,300,000","$35,000,000","$750,000",,,2.14%,3.07,,,,Zeeshan
https://www.bizbuysell.com/Business-Opportunity/top-performing-restoration-franchise-serving-multiple-states/2308411/,,Top Performing Restoration Franchise Serving Multiple States,"Pasadena, CA","This restoration company is a top performer for a national restoration Franchise and serves the Los Angeles Area and parts of Arizona. The Company provides restoration services to address fire damage, water damage, mold, biohazard cleaning, storm response and large loss CAT work.- Highly Trained & Talented Leadership Team- National Brand Awareness- Turnkey Systems in Place- Healthy Revenue MixFor private equity or group investors, please contact bob@rbasells.com directly.Accessing detailed information about our business opportunities requires a current prequalification letter from a recognized bank or financial institution. This ensures that only qualified buyers engage in the discovery process, providing sellers with confidence and protecting buyer interests. We look forward to assisting serious buyers through a seamless and secure transaction process. Cash buyers will be asked for proof of funds.","$4,200,000","$4,089,663","$1,660,641",,,40.61%,2.53,,,,Zeeshan
https://www.bizbuysell.com/Business-Opportunity/profitable-promotional-advertising-and-embroidery-business-for-sale/2232791/,,"Profitable Promotional, Advertising and Embroidery Business For Sale","Torrance, CA","This business offers quality embroidery and helps with branding and marketing for businesses and organizations as well as create customizable campaigns with a wide variety of products like apparel, shirts, promotional products, printed materials and more.Embroidery, screen printing and promotional products including, apparel, bags, drinkware, embroidery, screen printing, pens and marketing solutions. Percentage of revenue that each product/service accounts for:50% embroidery35% screen printing15% promotional","$289,500","$644,095","$105,000","$80,000",,16.30%,2.76,,,,Zeeshan
https://www.bizbuysell.com/Business-Opportunity/multi-division-catering-business-w-recurring-revandupside-potential/2184966/,,Multi-Division Catering Business w/Recurring Rev&Upside Potential,"Orange County, CA","This business is a leader in the catering industry, comprised of multiple divisions with recurring revenues and is poised for further growth in multiple areas in the hands of the right new owner. The business is brand-recognized with a well-established reputation and long-standing community presence. With over two decades in the industry, this business is in a prime location for easy access. The business has seen consistent growth in revenue year over year with many word-of-mouth referrals. A buyer could follow multiple avenues of growth to build off the foundation set by the current owner. The business has the proper infrastructure and organization make up to successfully operate without daily involvement of the owner.Ad#:2184966","$2,795,000","$4,600,000","$696,000","$110,000",,15.13%,4.02,,,,Zeeshan
https://www.bizbuysell.com/Business-Opportunity/landmark-mediterranean-restaurant-with-full-liquor-license/2288572/,,Landmark Mediterranean Restaurant With Full Liquor License,"Los Angeles, CA","Turnkey Restaurant Opportunity: This established restaurant is a community favorite, conveniently located just a short walk from the Americana shopping center. With ample parking and a full liquor license, it offers a significant advantage over nearby competitors. The business includes high-quality kitchen equipment, fixtures, and furniture, valued at over half a million dollars. A dedicated team of employees, many with decades of experience, ensures a smooth transition for the new owner. This turnkey investment presents a prime opportunity for savvy restaurateurs.","$550,000","$2,525,000","$255,000","$512,160",,10.10%,2.16,,,,Zeeshan
